{
  "schema_version": 1,
  "reference": {
    "node": "26.11.1",
    "v8": "14.6.202.34-node.37",
    "icu": "78.3",
    "unicode": "17.0",
    "tz": "2026e",
    "cldr": "48.0"
  },
  "seed": {
    "node": "22.21.1",
    "v8": "12.4.254.21-node.33",
    "icu": "77.1",
    "unicode": "16.0",
    "tz": "2025b",
    "cldr": "47.0"
  },
  "typescript": "5.1.6",
  "counts": {
    "total": 246,
    "same": 245,
    "changed": 0,
    "bad_probe": 1,
    "nondeterministic": 0
  },
  "probes": [
    {
      "id": "K_arrays__array_concat",
      "set": "calib",
      "status": "SAME"
    },
    {
      "id": "K_arrays__array_for_each",
      "set": "calib",
      "status": "SAME"
    },
    {
      "id": "K_arrays__array_includes",
      "set": "calib",
      "status": "SAME"
    },
    {
      "id": "K_arrays__array_index_of",
      "set": "calib",
      "status": "SAME"
    },
    {
      "id": "K_arrays__array_join",
      "set": "calib",
      "status": "SAME"
    },
    {
      "id": "K_arrays__array_push",
      "set": "calib",
      "status": "SAME"
    },
    {
      "id": "K_arrays__array_reduce_with_initial",
      "set": "calib",
      "status": "SAME"
    },
    {
      "id": "K_arrays__array_reverse",
      "set": "calib",
      "status": "SAME"
    },
    {
      "id": "K_arrays__array_shift",
      "set": "calib",
      "status": "SAME"
    },
    {
      "id": "K_arrays__array_slice",
      "set": "calib",
      "status": "SAME"
    },
    {
      "id": "K_arrays__array_sort",
      "set": "calib",
      "status": "SAME"
    },
    {
      "id": "K_basic__arithmetic_operations",
      "set": "calib",
      "status": "SAME"
    },
    {
      "id": "K_basic__boolean_logic",
      "set": "calib",
      "status": "SAME"
    },
    {
      "id": "K_basic__comparison_operators",
      "set": "calib",
      "status": "SAME"
    },
    {
      "id": "K_basic__const_vs_let",
      "set": "calib",
      "status": "SAME"
    },
    {
      "id": "K_basic__exponentiation",
      "set": "calib",
      "status": "SAME"
    },
    {
      "id": "K_basic__if_else",
      "set": "calib",
      "status": "SAME"
    },
    {
      "id": "K_basic__logical_not",
      "set": "calib",
      "status": "SAME"
    },
    {
      "id": "K_basic__parenthesized_precedence",
      "set": "calib",
      "status": "SAME"
    },
    {
      "id": "K_basic__simple_addition",
      "set": "calib",
      "status": "SAME"
    },
    {
      "id": "K_basic__string_concatenation",
      "set": "calib",
      "status": "SAME"
    },
    {
      "id": "K_basic__unary_negation",
      "set": "calib",
      "status": "SAME"
    },
    {
      "id": "K_basic__while_loop",
      "set": "calib",
      "status": "SAME"
    },
    {
      "id": "K_console__console_log_boolean",
      "set": "calib",
      "status": "SAME"
    },
    {
      "id": "K_console__console_log_number",
      "set": "calib",
      "status": "SAME"
    },
    {
      "id": "K_console__console_log_string",
      "set": "calib",
      "status": "SAME"
    },
    {
      "id": "K_control_flow__do_while_loop",
      "set": "calib",
      "status": "SAME"
    },
    {
      "id": "K_control_flow__for_loop",
      "set": "calib",
      "status": "SAME"
    },
    {
      "id": "K_control_flow__for_of_loop",
      "set": "calib",
      "status": "SAME"
    },
    {
      "id": "K_control_flow__switch_basic",
      "set": "calib",
      "status": "SAME"
    },
    {
      "id": "K_error_handling__nested_try_catch",
      "set": "calib",
      "status": "SAME"
    },
    {
      "id": "K_error_handling__try_catch_basic",
      "set": "calib",
      "status": "SAME"
    },
    {
      "id": "K_error_handling__try_catch_no_throw",
      "set": "calib",
      "status": "SAME"
    },
    {
      "id": "K_error_handling__try_catch_throw",
      "set": "calib",
      "status": "SAME"
    },
    {
      "id": "K_getters_setters__getter_only_computed",
      "set": "calib",
      "status": "SAME"
    },
    {
      "id": "K_getters_setters__getter_setter_basic",
      "set": "calib",
      "status": "SAME"
    },
    {
      "id": "K_getters_setters__setter_with_validation",
      "set": "calib",
      "status": "SAME"
    },
    {
      "id": "K_inheritance__class_inheritance_basic",
      "set": "calib",
      "status": "SAME"
    },
    {
      "id": "K_inheritance__class_inheritance_method_override",
      "set": "calib",
      "status": "SAME"
    },
    {
      "id": "K_math__math_abs",
      "set": "calib",
      "status": "SAME"
    },
    {
      "id": "K_math__math_e_constant",
      "set": "calib",
      "status": "SAME"
    },
    {
      "id": "K_math__math_floor_ceil_round",
      "set": "calib",
      "status": "SAME"
    },
    {
      "id": "K_math__math_log",
      "set": "calib",
      "status": "SAME"
    },
    {
      "id": "K_math__math_max_min",
      "set": "calib",
      "status": "SAME"
    },
    {
      "id": "K_math__math_pi",
      "set": "calib",
      "status": "SAME"
    },
    {
      "id": "K_math__math_pow",
      "set": "calib",
      "status": "SAME"
    },
    {
      "id": "K_math__math_sign",
      "set": "calib",
      "status": "SAME"
    },
    {
      "id": "K_math__math_sin_cos_tan",
      "set": "calib",
      "status": "SAME"
    },
    {
      "id": "K_math__math_sqrt",
      "set": "calib",
      "status": "SAME"
    },
    {
      "id": "K_math__math_trunc",
      "set": "calib",
      "status": "SAME"
    },
    {
      "id": "K_nestjs_logic__app_service_health",
      "set": "calib",
      "status": "SAME"
    },
    {
      "id": "K_nestjs_logic__class_composition_di",
      "set": "calib",
      "status": "SAME"
    },
    {
      "id": "K_nestjs_logic__multi_service_create_sequence",
      "set": "calib",
      "status": "SAME"
    },
    {
      "id": "K_nestjs_logic__users_service_create",
      "set": "calib",
      "status": "SAME"
    },
    {
      "id": "K_nestjs_logic__users_service_find_all",
      "set": "calib",
      "status": "SAME"
    },
    {
      "id": "K_spread__array_spread_single",
      "set": "calib",
      "status": "SAME"
    },
    {
      "id": "K_spread__array_spread_two_arrays",
      "set": "calib",
      "status": "SAME"
    },
    {
      "id": "K_spread__array_spread_with_elements",
      "set": "calib",
      "status": "SAME"
    },
    {
      "id": "K_spread__object_spread_copy",
      "set": "calib",
      "status": "SAME"
    },
    {
      "id": "K_spread__object_spread_override",
      "set": "calib",
      "status": "SAME"
    },
    {
      "id": "K_sprint1__all_assign_ops",
      "set": "calib",
      "status": "SAME"
    },
    {
      "id": "K_sprint1__bitwise_and_assign",
      "set": "calib",
      "status": "SAME"
    },
    {
      "id": "K_sprint1__bitwise_or_assign",
      "set": "calib",
      "status": "SAME"
    },
    {
      "id": "K_sprint1__bitwise_xor_assign",
      "set": "calib",
      "status": "SAME"
    },
    {
      "id": "K_sprint1__date_now_type",
      "set": "calib",
      "status": "SAME"
    },
    {
      "id": "K_sprint1__divide_assign",
      "set": "calib",
      "status": "SAME"
    },
    {
      "id": "K_sprint1__left_shift_assign",
      "set": "calib",
      "status": "SAME"
    },
    {
      "id": "K_sprint1__map_delete",
      "set": "calib",
      "status": "SAME"
    },
    {
      "id": "K_sprint1__map_set_get_has",
      "set": "calib",
      "status": "SAME"
    },
    {
      "id": "K_sprint1__modulo_assign",
      "set": "calib",
      "status": "SAME"
    },
    {
      "id": "K_sprint1__multiply_assign",
      "set": "calib",
      "status": "SAME"
    },
    {
      "id": "K_sprint1__right_shift_assign",
      "set": "calib",
      "status": "SAME"
    },
    {
      "id": "K_sprint1__set_add_has",
      "set": "calib",
      "status": "SAME"
    },
    {
      "id": "K_sprint1__set_delete",
      "set": "calib",
      "status": "SAME"
    },
    {
      "id": "K_sprint1__subtract_assign",
      "set": "calib",
      "status": "SAME"
    },
    {
      "id": "K_sprint1__this_method_call",
      "set": "calib",
      "status": "SAME"
    },
    {
      "id": "K_static_members__static_and_instance",
      "set": "calib",
      "status": "SAME"
    },
    {
      "id": "K_static_members__static_method",
      "set": "calib",
      "status": "SAME"
    },
    {
      "id": "K_strings__string_char_at",
      "set": "calib",
      "status": "SAME"
    },
    {
      "id": "K_strings__string_ends_with",
      "set": "calib",
      "status": "SAME"
    },
    {
      "id": "K_strings__string_includes",
      "set": "calib",
      "status": "SAME"
    },
    {
      "id": "K_strings__string_index_of",
      "set": "calib",
      "status": "SAME"
    },
    {
      "id": "K_strings__string_pad_end",
      "set": "calib",
      "status": "SAME"
    },
    {
      "id": "K_strings__string_pad_start",
      "set": "calib",
      "status": "SAME"
    },
    {
      "id": "K_strings__string_repeat",
      "set": "calib",
      "status": "SAME"
    },
    {
      "id": "K_strings__string_replace",
      "set": "calib",
      "status": "SAME"
    },
    {
      "id": "K_strings__string_slice",
      "set": "calib",
      "status": "SAME"
    },
    {
      "id": "K_strings__string_starts_with",
      "set": "calib",
      "status": "SAME"
    },
    {
      "id": "K_strings__string_substring",
      "set": "calib",
      "status": "SAME"
    },
    {
      "id": "K_strings__string_to_lower_case",
      "set": "calib",
      "status": "SAME"
    },
    {
      "id": "K_strings__string_to_upper_case",
      "set": "calib",
      "status": "SAME"
    },
    {
      "id": "K_strings__string_trim",
      "set": "calib",
      "status": "SAME"
    },
    {
      "id": "K_top_level__top_level_bare_expr_stmt",
      "set": "calib",
      "status": "SAME"
    },
    {
      "id": "K_top_level__top_level_const",
      "set": "calib",
      "status": "SAME"
    },